{
  "name": "akan",
  "languageCode": "ak",
  "locale": "ak-GH",
  "countries": [
    "GH"
  ],
  "regions": [
    "West Africa"
  ],
  "version": "0.18.2",
  "displayName": "Akan",
  "description": "Akan keyword map — starter pack (community contributions welcome)",
  "reviewStatus": "starter",
  "contributors": [
    "KolanutTechnologies"
  ],
  "targets": [
    "javascript",
    "python",
    "typescript",
    "go",
    "rust",
    "java",
    "c",
    "cpp",
    "csharp",
    "kotlin",
    "swift",
    "dart",
    "ruby",
    "php",
    "r"
  ],
  "keywords": {
    "IF": [
      "sɛ"
    ],
    "ELSE": [
      "sɛ ɛnyɛ saa a"
    ],
    "FOR": [
      "ma"
    ],
    "WHILE": [
      "bere a"
    ],
    "BREAK": [
      "bua"
    ],
    "CONTINUE": [
      "toa so"
    ],
    "SWITCH": [
      "paw"
    ],
    "CASE": [
      "sɛbea"
    ],
    "DEFAULT": [
      "deɛ ɛwɔ hɔ"
    ],
    "FUNCTION": [
      "adwuma",
      "dwuma"
    ],
    "RETURN": [
      "san kɔ"
    ],
    "ASYNC": [
      "async"
    ],
    "AWAIT": [
      "twɛn"
    ],
    "TRY": [
      "bɔ mmɔden"
    ],
    "CATCH": [
      "kyere"
    ],
    "FINALLY": [
      "ewie"
    ],
    "THROW": [
      "to gu"
    ],
    "LET": [
      "let"
    ],
    "CONST": [
      "gyina pintinn"
    ],
    "CLASS": [
      "kuw",
      "ekuri"
    ],
    "EXTENDS": [
      "extends"
    ],
    "NEW": [
      "foforo"
    ],
    "THIS": [
      "wei"
    ],
    "IMPORT": [
      "fa ba"
    ],
    "EXPORT": [
      "ma kɔ"
    ],
    "PRINT": [
      "kyerɛ"
    ],
    "TRUE": [
      "nokware"
    ],
    "FALSE": [
      "atoro"
    ],
    "NULL": [
      "hwee"
    ],
    "UNDEFINED": [
      "nnyɛ nkyerɛase"
    ],
    "ELIF": [
      "elif"
    ],
    "LOOP": [
      "loop"
    ],
    "MATCH": [
      "match"
    ],
    "GOTO": [
      "goto"
    ],
    "FALLTHROUGH": [
      "fallthrough"
    ],
    "SELECT": [
      "select"
    ],
    "RANGE": [
      "range"
    ],
    "YIELD": [
      "yield"
    ],
    "LAMBDA": [
      "lambda"
    ],
    "DEFER": [
      "defer"
    ],
    "GO": [
      "go"
    ],
    "VAR": [
      "var"
    ],
    "MUT": [
      "mut"
    ],
    "GLOBAL": [
      "global"
    ],
    "NONLOCAL": [
      "nonlocal"
    ],
    "STRUCT": [
      "struct"
    ],
    "TRAIT": [
      "trait"
    ],
    "IMPL": [
      "impl"
    ],
    "INTERFACE": [
      "interface"
    ],
    "ENUM": [
      "enum"
    ],
    "TYPE": [
      "type"
    ],
    "IMPLEMENTS": [
      "implements"
    ],
    "SELF": [
      "self"
    ],
    "SUPER": [
      "super"
    ],
    "STATIC": [
      "static"
    ],
    "FROM": [
      "from"
    ],
    "AS": [
      "as"
    ],
    "MODULE": [
      "module"
    ],
    "NAMESPACE": [
      "namespace"
    ],
    "PACKAGE": [
      "package"
    ],
    "USE": [
      "use"
    ],
    "PUB": [
      "public"
    ],
    "CRATE": [
      "crate"
    ],
    "WITH": [
      "with"
    ],
    "PASS": [
      "pass"
    ],
    "ASSERT": [
      "assert"
    ],
    "ASSERTS": [
      "asserts"
    ],
    "NIL": [
      "null"
    ],
    "UNSAFE": [
      "unsafe"
    ],
    "EXTERN": [
      "declare"
    ],
    "CHAN": [
      "chan"
    ],
    "MAP": [
      "map"
    ],
    "AND": [
      "and"
    ],
    "OR": [
      "or"
    ],
    "NOT": [
      "not"
    ],
    "IN": [
      "in"
    ],
    "IS": [
      "is"
    ],
    "DEL": [
      "del"
    ],
    "DO": [
      "do"
    ],
    "DEBUGGER": [
      "debugger"
    ],
    "TYPEOF": [
      "typeof"
    ],
    "VOID": [
      "void"
    ],
    "INSTANCEOF": [
      "instanceof"
    ],
    "PRIVATE": [
      "private"
    ],
    "PROTECTED": [
      "protected"
    ],
    "PUBLIC": [
      "public"
    ],
    "READONLY": [
      "readonly"
    ],
    "ABSTRACT": [
      "abstract"
    ],
    "DECLARE": [
      "declare"
    ],
    "GET": [
      "get"
    ],
    "SET": [
      "set"
    ],
    "INFER": [
      "infer"
    ],
    "KEYOF": [
      "keyof"
    ],
    "UNIQUE": [
      "unique"
    ],
    "SATISFIES": [
      "satisfies"
    ],
    "ANY": [
      "any"
    ],
    "BOOLEAN": [
      "boolean"
    ],
    "NUMBER": [
      "number"
    ],
    "STRING": [
      "string"
    ],
    "SYMBOL": [
      "symbol"
    ],
    "OBJECT": [
      "object"
    ],
    "NEVER": [
      "never"
    ],
    "UNKNOWN": [
      "unknown"
    ],
    "BIGINT": [
      "bigint"
    ],
    "CONSTRUCTOR": [
      "constructor"
    ],
    "REQUIRE": [
      "require"
    ],
    "USING": [
      "using"
    ],
    "OF": [
      "of"
    ],
    "DYN": [
      "dyn"
    ],
    "MOVE": [
      "move"
    ],
    "REF": [
      "ref"
    ],
    "WHERE": [
      "where"
    ],
    "GEN": [
      "gen"
    ],
    "LAZY": [
      "lazy"
    ],
    "BYTE": [
      "byte"
    ],
    "CHAR": [
      "char"
    ],
    "SHORT": [
      "short"
    ],
    "INT": [
      "int"
    ],
    "LONG": [
      "long"
    ],
    "FLOAT": [
      "float"
    ],
    "DOUBLE": [
      "double"
    ],
    "FINAL": [
      "final"
    ],
    "NATIVE": [
      "native"
    ],
    "STRICTFP": [
      "strictfp"
    ],
    "SYNCHRONIZED": [
      "synchronized"
    ],
    "THROWS": [
      "throws"
    ],
    "TRANSIENT": [
      "transient"
    ],
    "VOLATILE": [
      "volatile"
    ],
    "UNDERSCORE": [
      "_"
    ],
    "AUTO": [
      "auto"
    ],
    "REGISTER": [
      "register"
    ],
    "SIGNED": [
      "signed"
    ],
    "UNSIGNED": [
      "unsigned"
    ],
    "SIZEOF": [
      "sizeof"
    ],
    "TYPEDEF": [
      "typedef"
    ],
    "UNION": [
      "union"
    ],
    "INLINE": [
      "inline"
    ],
    "RESTRICT": [
      "restrict"
    ],
    "C_BOOL": [
      "c_bool"
    ],
    "C_COMPLEX": [
      "c_complex"
    ],
    "C_IMAGINARY": [
      "c_imaginary"
    ],
    "C_ALIGNAS": [
      "c_alignas"
    ],
    "C_ALIGNOF": [
      "c_alignof"
    ],
    "C_ATOMIC": [
      "c_atomic"
    ],
    "C_GENERIC": [
      "c_generic"
    ],
    "C_NORETURN": [
      "c_noreturn"
    ],
    "C_STATIC_ASSERT": [
      "c_static_assert"
    ],
    "C_THREAD_LOCAL": [
      "c_thread_local"
    ],
    "ASM": [
      "asm"
    ],
    "TEMPLATE": [
      "template"
    ],
    "VIRTUAL": [
      "virtual"
    ],
    "TYPENAME": [
      "typename"
    ],
    "CONSTEXPR": [
      "constexpr"
    ],
    "CONSTEVAL": [
      "consteval"
    ],
    "CONSTINIT": [
      "constinit"
    ],
    "NOEXCEPT": [
      "noexcept"
    ],
    "DECLTYPE": [
      "decltype"
    ],
    "NULLPTR": [
      "nullptr"
    ],
    "OPERATOR": [
      "operator"
    ],
    "FRIEND": [
      "friend"
    ],
    "EXPLICIT": [
      "explicit"
    ],
    "MUTABLE": [
      "mutable"
    ],
    "CONCEPT": [
      "concept"
    ],
    "REQUIRES": [
      "requires"
    ],
    "CO_AWAIT": [
      "co_await"
    ],
    "CO_RETURN": [
      "co_return"
    ],
    "CO_YIELD": [
      "co_yield"
    ],
    "CHAR8_T": [
      "char8_t"
    ],
    "CHAR16_T": [
      "char16_t"
    ],
    "CHAR32_T": [
      "char32_t"
    ],
    "WCHAR_T": [
      "wchar_t"
    ],
    "TYPEID": [
      "typeid"
    ],
    "STATIC_CAST": [
      "static_cast"
    ],
    "DYNAMIC_CAST": [
      "dynamic_cast"
    ],
    "REINTERPRET_CAST": [
      "reinterpret_cast"
    ],
    "CONST_CAST": [
      "const_cast"
    ],
    "DELETE": [
      "delete"
    ],
    "BITAND": [
      "bitand"
    ],
    "BITOR": [
      "bitor"
    ],
    "COMPL": [
      "compl"
    ],
    "XOR": [
      "xor"
    ],
    "XOR_EQ": [
      "xor_eq"
    ],
    "AND_EQ": [
      "and_eq"
    ],
    "OR_EQ": [
      "or_eq"
    ],
    "NOT_EQ": [
      "not_eq"
    ],
    "DELEGATE": [
      "delegate"
    ],
    "EVENT": [
      "event"
    ],
    "LOCK": [
      "lock"
    ],
    "SEALED": [
      "sealed"
    ],
    "OVERRIDE": [
      "override"
    ],
    "FOREACH": [
      "foreach"
    ],
    "PARTIAL": [
      "partial"
    ],
    "PARAMS": [
      "params"
    ],
    "INTERNAL": [
      "internal"
    ],
    "CHECKED": [
      "checked"
    ],
    "UNCHECKED": [
      "unchecked"
    ],
    "FIXED": [
      "fixed"
    ],
    "STACKALLOC": [
      "stackalloc"
    ],
    "SBYTE": [
      "sbyte"
    ],
    "UINT": [
      "uint"
    ],
    "ULONG": [
      "ulong"
    ],
    "USHORT": [
      "ushort"
    ],
    "IMPLICIT": [
      "implicit"
    ],
    "OUT": [
      "out"
    ],
    "ADD": [
      "add"
    ],
    "REMOVE": [
      "remove"
    ],
    "DYNAMIC": [
      "dynamic"
    ],
    "EQUALS": [
      "equals"
    ],
    "ALIAS": [
      "alias"
    ],
    "NAMEOF": [
      "nameof"
    ],
    "WHEN": [
      "when"
    ],
    "BY": [
      "by"
    ],
    "ASCENDING": [
      "ascending"
    ],
    "DESCENDING": [
      "descending"
    ],
    "GROUP": [
      "group"
    ],
    "INTO": [
      "into"
    ],
    "JOIN": [
      "join"
    ],
    "ON": [
      "on"
    ],
    "ORDERBY": [
      "orderby"
    ],
    "VALUE": [
      "value"
    ],
    "DECIMAL": [
      "decimal"
    ],
    "VAL": [
      "val"
    ],
    "SUSPEND": [
      "suspend"
    ],
    "TYPEALIAS": [
      "typealias"
    ],
    "COMPANION": [
      "companion"
    ],
    "DATA": [
      "data"
    ],
    "LATEINIT": [
      "lateinit"
    ],
    "REIFIED": [
      "reified"
    ],
    "TAILREC": [
      "tailrec"
    ],
    "INFIX": [
      "infix"
    ],
    "CROSSINLINE": [
      "crossinline"
    ],
    "NOINLINE": [
      "noinline"
    ],
    "ACTUAL": [
      "actual"
    ],
    "EXPECT": [
      "expect"
    ],
    "ANNOTATION": [
      "annotation"
    ],
    "VARARG": [
      "vararg"
    ],
    "INIT": [
      "init"
    ],
    "OPEN": [
      "open"
    ],
    "INNER": [
      "inner"
    ],
    "FIELD": [
      "field"
    ],
    "RECEIVER": [
      "receiver"
    ],
    "SETPARAM": [
      "setparam"
    ],
    "PARAM": [
      "param"
    ],
    "FILE": [
      "file"
    ],
    "AS_SAFE": [
      "as_safe"
    ],
    "NOT_IN": [
      "not_in"